{"format":"broadcast-scene","version":"0.2.0","source":{"application":"ofxOGraf","compName":"ograf.dev News Ticker","url":"https://ograf.dev/tutorials/ticker","license":"MIT"},"composition":{"width":1920,"height":1080,"duration":12,"frameRate":50},"assets":{"fonts":[],"images":[]},"controls":[{"id":"label","name":"Label","type":"string","default":"BREAKING"},{"id":"headline","name":"Headline","type":"string","default":"This is a live scrolling headline from the ofxOGraf runtime"}],"layers":[{"index":1,"name":"Label","type":"text","enabled":true,"inPoint":0,"outPoint":12,"controlId":"label","text":{"name":"Source Text","matchName":"ADBE Text Document","value":{"text":"BREAKING","font":"Arial-BoldMT","fontSize":34,"fillColor":[1,1,1],"applyFill":true},"keyframes":[]},"transform":{"name":"Transform","matchName":"ADBE Transform Group","children":[{"name":"Position","matchName":"ADBE Position","value":[55,1028],"keyframes":[]}]}},{"index":2,"name":"Label Bar","type":"shape","enabled":true,"inPoint":0,"outPoint":12,"transform":{"name":"Transform","matchName":"ADBE Transform Group","children":[{"name":"Position","matchName":"ADBE Position","value":[180,1015],"keyframes":[]}]},"contents":{"name":"Contents","matchName":"ADBE Root Vectors Group","children":[{"name":"Rectangle","matchName":"ADBE Vector Shape - Rect","children":[{"name":"Size","matchName":"ADBE Vector Rect Size","value":[360,130],"keyframes":[]}]},{"name":"Fill Color","matchName":"ADBE Vector Fill Color","value":[0.9,0.08,0.14],"keyframes":[]}]}},{"index":3,"name":"Headline","type":"text","enabled":true,"inPoint":0,"outPoint":12,"controlId":"headline","text":{"name":"Source Text","matchName":"ADBE Text Document","value":{"text":"This is a live scrolling headline from the ofxOGraf runtime","font":"ArialMT","fontSize":38,"fillColor":[1,1,1],"applyFill":true},"keyframes":[]},"transform":{"name":"Transform","matchName":"ADBE Transform Group","children":[{"name":"Position","matchName":"ADBE Position","keyframes":[{"time":0,"value":[1950,1028],"outInterpolation":"linear"},{"time":12,"value":[-1500,1028],"inInterpolation":"linear"}]}]}},{"index":4,"name":"Ticker Bar","type":"shape","enabled":true,"inPoint":0,"outPoint":12,"transform":{"name":"Transform","matchName":"ADBE Transform Group","children":[{"name":"Position","matchName":"ADBE Position","value":[960,1015],"keyframes":[]}]},"contents":{"name":"Contents","matchName":"ADBE Root Vectors Group","children":[{"name":"Rectangle","matchName":"ADBE Vector Shape - Rect","children":[{"name":"Size","matchName":"ADBE Vector Rect Size","value":[1920,130],"keyframes":[]}]},{"name":"Fill Color","matchName":"ADBE Vector Fill Color","value":[0.025,0.03,0.05],"keyframes":[]}]}}],"compositions":[],"report":{"unsupported":[],"warnings":[],"fallbacks":[]}}
