{"format":"broadcast-scene","version":"0.2.0","source":{"application":"ofxOGraf","compName":"ograf.dev Score Bug","url":"https://ograf.dev/tutorials/score-bug","license":"MIT"},"composition":{"width":1920,"height":1080,"duration":10,"frameRate":50},"assets":{"fonts":[],"images":[]},"controls":[{"id":"home","name":"Home Team","type":"string","default":"HOME"},{"id":"away","name":"Away Team","type":"string","default":"AWAY"},{"id":"homeScore","name":"Home Score","type":"string","default":"2"},{"id":"awayScore","name":"Away Score","type":"string","default":"1"},{"id":"clock","name":"Clock","type":"string","default":"67:42"}],"layers":[{"index":1,"name":"Clock","type":"text","enabled":true,"inPoint":0,"outPoint":10,"controlId":"clock","text":{"name":"Source Text","matchName":"ADBE Text Document","value":{"text":"67:42","font":"ArialMT","fontSize":22,"fillColor":[0.75,0.8,0.9],"applyFill":true},"keyframes":[]},"transform":{"name":"Transform","matchName":"ADBE Transform Group","children":[{"name":"Position","matchName":"ADBE Position","value":[905,140],"keyframes":[]}]}},{"index":2,"name":"Away Score","type":"text","enabled":true,"inPoint":0,"outPoint":10,"controlId":"awayScore","text":{"name":"Source Text","matchName":"ADBE Text Document","value":{"text":"1","font":"Arial-BoldMT","fontSize":48,"fillColor":[1,1,1],"applyFill":true},"keyframes":[]},"transform":{"name":"Transform","matchName":"ADBE Transform Group","children":[{"name":"Position","matchName":"ADBE Position","value":[1000,98],"keyframes":[]}]}},{"index":3,"name":"Home Score","type":"text","enabled":true,"inPoint":0,"outPoint":10,"controlId":"homeScore","text":{"name":"Source Text","matchName":"ADBE Text Document","value":{"text":"2","font":"Arial-BoldMT","fontSize":48,"fillColor":[1,1,1],"applyFill":true},"keyframes":[]},"transform":{"name":"Transform","matchName":"ADBE Transform Group","children":[{"name":"Position","matchName":"ADBE Position","value":[905,98],"keyframes":[]}]}},{"index":4,"name":"Away","type":"text","enabled":true,"inPoint":0,"outPoint":10,"controlId":"away","text":{"name":"Source Text","matchName":"ADBE Text Document","value":{"text":"AWAY","font":"Arial-BoldMT","fontSize":32,"fillColor":[1,1,1],"applyFill":true},"keyframes":[]},"transform":{"name":"Transform","matchName":"ADBE Transform Group","children":[{"name":"Position","matchName":"ADBE Position","value":[1130,82],"keyframes":[]}]}},{"index":5,"name":"Home","type":"text","enabled":true,"inPoint":0,"outPoint":10,"controlId":"home","text":{"name":"Source Text","matchName":"ADBE Text Document","value":{"text":"HOME","font":"Arial-BoldMT","fontSize":32,"fillColor":[1,1,1],"applyFill":true},"keyframes":[]},"transform":{"name":"Transform","matchName":"ADBE Transform Group","children":[{"name":"Position","matchName":"ADBE Position","value":[650,82],"keyframes":[]}]}},{"index":6,"name":"Score Block","type":"shape","enabled":true,"inPoint":0,"outPoint":10,"transform":{"name":"Transform","matchName":"ADBE Transform Group","children":[{"name":"Position","matchName":"ADBE Position","value":[960,88],"keyframes":[]}]},"contents":{"name":"Contents","matchName":"ADBE Root Vectors Group","children":[{"name":"Rectangle","matchName":"ADBE Vector Shape - Rect","children":[{"name":"Size","matchName":"ADBE Vector Rect Size","value":[190,116],"keyframes":[]}]},{"name":"Fill Color","matchName":"ADBE Vector Fill Color","value":[0.1,0.55,1],"keyframes":[]}]}},{"index":7,"name":"Panel","type":"shape","enabled":true,"inPoint":0,"outPoint":10,"transform":{"name":"Transform","matchName":"ADBE Transform Group","children":[{"name":"Position","matchName":"ADBE Position","keyframes":[{"time":0,"value":[960,-130]},{"time":0.55,"value":[960,88],"inInterpolation":"bezier"}]}]},"contents":{"name":"Contents","matchName":"ADBE Root Vectors Group","children":[{"name":"Rectangle","matchName":"ADBE Vector Shape - Rect","children":[{"name":"Size","matchName":"ADBE Vector Rect Size","value":[700,116],"keyframes":[]}]},{"name":"Fill Color","matchName":"ADBE Vector Fill Color","value":[0.035,0.04,0.06],"keyframes":[]}]}}],"compositions":[],"report":{"unsupported":[],"warnings":[],"fallbacks":[]}}
